[
  {
    "entity_id": "DOC:KUE:KUE-PHI-0002-2026-DE",
    "typ": "Document",
    "name": "Gedächtnis als Zugriffsproblem",
    "domäne": "PHI",
    "status": "[I]",
    "is_instance": true,
    "beschreibung": "Essay / Modellskizze über die Trennung von Speicher, Zugriff, Reaktivierung, Herkunftsprüfung, Selektion sowie Erinnerung, Überzeugung und Zuverlässigkeit.",
    "erster_nachweis": "kueper.com / KUE-PHI-0002-2026-DE",
    "erstellt": "2026-08-09",
    "kurator": "T.P.K."
  }
]
